[
  {
    "ts": "2026-04-26T00:00:00+00:00",
    "event_type": "read",
    "ec_observed": 2.4824,
    "ph_observed": 6.5852,
    "volume_l": 5.0,
    "nutrient_ml": 0.0,
    "ph_up_ml": 0.0,
    "ph_down_ml": 0.0,
    "ph_setpoint": 6.0,
    "ph_deadband_low": 5.7,
    "ph_deadband_high": 6.3,
    "ec_setpoint": 1.8,
    "ec_deadband_low": 1.6,
    "ec_deadband_high": 2.0
  },
  {
    "ts": "2026-04-26T00:00:00+00:00",
    "event_type": "dose",
    "ec_observed": 2.4824,
    "ph_observed": 6.5852,
    "volume_l": 5.0,
    "nutrient_ml": 0.0,
    "ph_up_ml": 0.0,
    "ph_down_ml": 0.18,
    "ph_setpoint": 6.0,
    "ph_deadband_low": 5.7,
    "ph_deadband_high": 6.3,
    "ec_setpoint": 1.8,
    "ec_deadband_low": 1.6,
    "ec_deadband_high": 2.0
  },
  {
    "ts": "2026-04-26T00:02:00+00:00",
    "event_type": "read",
    "ec_observed": 2.4577,
    "ph_observed": 6.4174,
    "volume_l": 5.0002,
    "nutrient_ml": 0.0,
    "ph_up_ml": 0.0,
    "ph_down_ml": 0.0,
    "ph_setpoint": 6.0,
    "ph_deadband_low": 5.7,
    "ph_deadband_high": 6.3,
    "ec_setpoint": 1.8,
    "ec_deadband_low": 1.6,
    "ec_deadband_high": 2.0
  },
  {
    "ts": "2026-04-26T00:02:00+00:00",
    "event_type": "dose",
    "ec_observed": 2.4577,
    "ph_observed": 6.4174,
    "volume_l": 5.0002,
    "nutrient_ml": 0.0,
    "ph_up_ml": 0.0,
    "ph_down_ml": 0.13,
    "ph_setpoint": 6.0,
    "ph_deadband_low": 5.7,
    "ph_deadband_high": 6.3,
    "ec_setpoint": 1.8,
    "ec_deadband_low": 1.6,
    "ec_deadband_high": 2.0
  },
  {
    "ts": "2026-04-26T00:04:00+00:00",
    "event_type": "read",
    "ec_observed": 2.4356,
    "ph_observed": 6.3492,
    "volume_l": 5.0003,
    "nutrient_ml": 0.0,
    "ph_up_ml": 0.0,
    "ph_down_ml": 0.0,
    "ph_setpoint": 6.0,
    "ph_deadband_low": 5.7,
    "ph_deadband_high": 6.3,
    "ec_setpoint": 1.8,
    "ec_deadband_low": 1.6,
    "ec_deadband_high": 2.0
  },
  {
    "ts": "2026-04-26T00:04:00+00:00",
    "event_type": "dose",
    "ec_observed": 2.4356,
    "ph_observed": 6.3492,
    "volume_l": 5.0003,
    "nutrient_ml": 0.0,
    "ph_up_ml": 0.0,
    "ph_down_ml": 0.1,
    "ph_setpoint": 6.0,
    "ph_deadband_low": 5.7,
    "ph_deadband_high": 6.3,
    "ec_setpoint": 1.8,
    "ec_deadband_low": 1.6,
    "ec_deadband_high": 2.0
  },
  {
    "ts": "2026-04-26T00:06:00+00:00",
    "event_type": "read",
    "ec_observed": 2.3967,
    "ph_observed": 6.2185,
    "volume_l": 5.0004,
    "nutrient_ml": 0.0,
    "ph_up_ml": 0.0,
    "ph_down_ml": 0.0,
    "ph_setpoint": 6.0,
    "ph_deadband_low": 5.7,
    "ph_deadband_high": 6.3,
    "ec_setpoint": 1.8,
    "ec_deadband_low": 1.6,
    "ec_deadband_high": 2.0
  },
  {
    "ts": "2026-04-26T00:08:00+00:00",
    "event_type": "read",
    "ec_observed": 2.3992,
    "ph_observed": 6.1773,
    "volume_l": 5.0004,
    "nutrient_ml": 0.0,
    "ph_up_ml": 0.0,
    "ph_down_ml": 0.0,
    "ph_setpoint": 6.0,
    "ph_deadband_low": 5.7,
    "ph_deadband_high": 6.3,
    "ec_setpoint": 1.8,
    "ec_deadband_low": 1.6,
    "ec_deadband_high": 2.0
  },
  {
    "ts": "2026-04-26T00:10:00+00:00",
    "event_type": "read",
    "ec_observed": 2.3612,
    "ph_observed": 6.1978,
    "volume_l": 5.0004,
    "nutrient_ml": 0.0,
    "ph_up_ml": 0.0,
    "ph_down_ml": 0.0,
    "ph_setpoint": 6.0,
    "ph_deadband_low": 5.7,
    "ph_deadband_high": 6.3,
    "ec_setpoint": 1.8,
    "ec_deadband_low": 1.6,
    "ec_deadband_high": 2.0
  },
  {
    "ts": "2026-04-26T00:12:00+00:00",
    "event_type": "read",
    "ec_observed": 2.4077,
    "ph_observed": 6.2007,
    "volume_l": 5.0004,
    "nutrient_ml": 0.0,
    "ph_up_ml": 0.0,
    "ph_down_ml": 0.0,
    "ph_setpoint": 6.0,
    "ph_deadband_low": 5.7,
    "ph_deadband_high": 6.3,
    "ec_setpoint": 1.8,
    "ec_deadband_low": 1.6,
    "ec_deadband_high": 2.0
  },
  {
    "ts": "2026-04-26T00:14:00+00:00",
    "event_type": "read",
    "ec_observed": 2.3394,
    "ph_observed": 6.2265,
    "volume_l": 5.0004,
    "nutrient_ml": 0.0,
    "ph_up_ml": 0.0,
    "ph_down_ml": 0.0,
    "ph_setpoint": 6.0,
    "ph_deadband_low": 5.7,
    "ph_deadband_high": 6.3,
    "ec_setpoint": 1.8,
    "ec_deadband_low": 1.6,
    "ec_deadband_high": 2.0
  },
  {
    "ts": "2026-04-26T00:16:00+00:00",
    "event_type": "read",
    "ec_observed": 2.3789,
    "ph_observed": 6.2298,
    "volume_l": 5.0004,
    "nutrient_ml": 0.0,
    "ph_up_ml": 0.0,
    "ph_down_ml": 0.0,
    "ph_setpoint": 6.0,
    "ph_deadband_low": 5.7,
    "ph_deadband_high": 6.3,
    "ec_setpoint": 1.8,
    "ec_deadband_low": 1.6,
    "ec_deadband_high": 2.0
  },
  {
    "ts": "2026-04-26T00:18:00+00:00",
    "event_type": "read",
    "ec_observed": 2.3602,
    "ph_observed": 6.2277,
    "volume_l": 5.0004,
    "nutrient_ml": 0.0,
    "ph_up_ml": 0.0,
    "ph_down_ml": 0.0,
    "ph_setpoint": 6.0,
    "ph_deadband_low": 5.7,
    "ph_deadband_high": 6.3,
    "ec_setpoint": 1.8,
    "ec_deadband_low": 1.6,
    "ec_deadband_high": 2.0
  },
  {
    "ts": "2026-04-26T00:20:00+00:00",
    "event_type": "read",
    "ec_observed": 2.3556,
    "ph_observed": 6.1615,
    "volume_l": 5.0004,
    "nutrient_ml": 0.0,
    "ph_up_ml": 0.0,
    "ph_down_ml": 0.0,
    "ph_setpoint": 6.0,
    "ph_deadband_low": 5.7,
    "ph_deadband_high": 6.3,
    "ec_setpoint": 1.8,
    "ec_deadband_low": 1.6,
    "ec_deadband_high": 2.0
  },
  {
    "ts": "2026-04-26T00:22:00+00:00",
    "event_type": "read",
    "ec_observed": 2.4066,
    "ph_observed": 6.2338,
    "volume_l": 5.0004,
    "nutrient_ml": 0.0,
    "ph_up_ml": 0.0,
    "ph_down_ml": 0.0,
    "ph_setpoint": 6.0,
    "ph_deadband_low": 5.7,
    "ph_deadband_high": 6.3,
    "ec_setpoint": 1.8,
    "ec_deadband_low": 1.6,
    "ec_deadband_high": 2.0
  },
  {
    "ts": "2026-04-26T00:24:00+00:00",
    "event_type": "read",
    "ec_observed": 2.4146,
    "ph_observed": 6.2446,
    "volume_l": 5.0004,
    "nutrient_ml": 0.0,
    "ph_up_ml": 0.0,
    "ph_down_ml": 0.0,
    "ph_setpoint": 6.0,
    "ph_deadband_low": 5.7,
    "ph_deadband_high": 6.3,
    "ec_setpoint": 1.8,
    "ec_deadband_low": 1.6,
    "ec_deadband_high": 2.0
  },
  {
    "ts": "2026-04-26T00:26:00+00:00",
    "event_type": "read",
    "ec_observed": 2.359,
    "ph_observed": 6.2259,
    "volume_l": 5.0004,
    "nutrient_ml": 0.0,
    "ph_up_ml": 0.0,
    "ph_down_ml": 0.0,
    "ph_setpoint": 6.0,
    "ph_deadband_low": 5.7,
    "ph_deadband_high": 6.3,
    "ec_setpoint": 1.8,
    "ec_deadband_low": 1.6,
    "ec_deadband_high": 2.0
  },
  {
    "ts": "2026-04-26T00:28:00+00:00",
    "event_type": "read",
    "ec_observed": 2.3193,
    "ph_observed": 6.2652,
    "volume_l": 5.0004,
    "nutrient_ml": 0.0,
    "ph_up_ml": 0.0,
    "ph_down_ml": 0.0,
    "ph_setpoint": 6.0,
    "ph_deadband_low": 5.7,
    "ph_deadband_high": 6.3,
    "ec_setpoint": 1.8,
    "ec_deadband_low": 1.6,
    "ec_deadband_high": 2.0
  },
  {
    "ts": "2026-04-26T00:30:00+00:00",
    "event_type": "read",
    "ec_observed": 2.3649,
    "ph_observed": 6.2215,
    "volume_l": 5.0004,
    "nutrient_ml": 0.0,
    "ph_up_ml": 0.0,
    "ph_down_ml": 0.0,
    "ph_setpoint": 6.0,
    "ph_deadband_low": 5.7,
    "ph_deadband_high": 6.3,
    "ec_setpoint": 1.8,
    "ec_deadband_low": 1.6,
    "ec_deadband_high": 2.0
  },
  {
    "ts": "2026-04-26T00:32:00+00:00",
    "event_type": "read",
    "ec_observed": 2.4012,
    "ph_observed": 6.2218,
    "volume_l": 5.0004,
    "nutrient_ml": 0.0,
    "ph_up_ml": 0.0,
    "ph_down_ml": 0.0,
    "ph_setpoint": 6.0,
    "ph_deadband_low": 5.7,
    "ph_deadband_high": 6.3,
    "ec_setpoint": 1.8,
    "ec_deadband_low": 1.6,
    "ec_deadband_high": 2.0
  },
  {
    "ts": "2026-04-26T00:34:00+00:00",
    "event_type": "read",
    "ec_observed": 2.349,
    "ph_observed": 6.2241,
    "volume_l": 5.0004,
    "nutrient_ml": 0.0,
    "ph_up_ml": 0.0,
    "ph_down_ml": 0.0,
    "ph_setpoint": 6.0,
    "ph_deadband_low": 5.7,
    "ph_deadband_high": 6.3,
    "ec_setpoint": 1.8,
    "ec_deadband_low": 1.6,
    "ec_deadband_high": 2.0
  },
  {
    "ts": "2026-04-26T00:36:00+00:00",
    "event_type": "read",
    "ec_observed": 2.2933,
    "ph_observed": 6.2494,
    "volume_l": 5.0004,
    "nutrient_ml": 0.0,
    "ph_up_ml": 0.0,
    "ph_down_ml": 0.0,
    "ph_setpoint": 6.0,
    "ph_deadband_low": 5.7,
    "ph_deadband_high": 6.3,
    "ec_setpoint": 1.8,
    "ec_deadband_low": 1.6,
    "ec_deadband_high": 2.0
  },
  {
    "ts": "2026-04-26T00:38:00+00:00",
    "event_type": "read",
    "ec_observed": 2.3377,
    "ph_observed": 6.1893,
    "volume_l": 5.0004,
    "nutrient_ml": 0.0,
    "ph_up_ml": 0.0,
    "ph_down_ml": 0.0,
    "ph_setpoint": 6.0,
    "ph_deadband_low": 5.7,
    "ph_deadband_high": 6.3,
    "ec_setpoint": 1.8,
    "ec_deadband_low": 1.6,
    "ec_deadband_high": 2.0
  },
  {
    "ts": "2026-04-26T00:40:00+00:00",
    "event_type": "read",
    "ec_observed": 2.3005,
    "ph_observed": 6.2896,
    "volume_l": 5.0004,
    "nutrient_ml": 0.0,
    "ph_up_ml": 0.0,
    "ph_down_ml": 0.0,
    "ph_setpoint": 6.0,
    "ph_deadband_low": 5.7,
    "ph_deadband_high": 6.3,
    "ec_setpoint": 1.8,
    "ec_deadband_low": 1.6,
    "ec_deadband_high": 2.0
  },
  {
    "ts": "2026-04-26T00:42:00+00:00",
    "event_type": "read",
    "ec_observed": 2.3146,
    "ph_observed": 6.2124,
    "volume_l": 5.0004,
    "nutrient_ml": 0.0,
    "ph_up_ml": 0.0,
    "ph_down_ml": 0.0,
    "ph_setpoint": 6.0,
    "ph_deadband_low": 5.7,
    "ph_deadband_high": 6.3,
    "ec_setpoint": 1.8,
    "ec_deadband_low": 1.6,
    "ec_deadband_high": 2.0
  },
  {
    "ts": "2026-04-26T00:44:00+00:00",
    "event_type": "read",
    "ec_observed": 2.2554,
    "ph_observed": 6.221,
    "volume_l": 5.0004,
    "nutrient_ml": 0.0,
    "ph_up_ml": 0.0,
    "ph_down_ml": 0.0,
    "ph_setpoint": 6.0,
    "ph_deadband_low": 5.7,
    "ph_deadband_high": 6.3,
    "ec_setpoint": 1.8,
    "ec_deadband_low": 1.6,
    "ec_deadband_high": 2.0
  },
  {
    "ts": "2026-04-26T00:46:00+00:00",
    "event_type": "read",
    "ec_observed": 2.2786,